{"artifact_count":127,"error_count":0,"file_count":127,"input_dir":"study_results","model":"executable_artifact_contract_batch_validation","model_limits":["top_level_json_schema_compatibility_export","executable_elixir_validator_is_source_of_truth","semantic_checks_are_not_fully_represented_in_json_schema"],"remediation_count":0,"reports":[{"path":"study_results/accepted_planning_state_oem.json","report":{"artifact_path":"study_results/accepted_planning_state_oem.json","assumptions":{"json_schema_export_scope":"top_level_compatibility","validation_scope":"executable_contract_required_fields_and_semantic_checks","validator":"OrbitalDynamics.Schema.validate_artifact"},"error_count":0,"errors":[],"model":"executable_artifact_contract_validation","model_limits":["top_level_json_schema_compatibility_export","executable_elixir_validator_is_source_of_truth","semantic_checks_are_not_fully_represented_in_json_schema"],"remediation":[],"remediation_count":0,"schema_contract":"schema_validation_report.v1","status":"pass","validated_artifact_family":"accepted_planning_state","validated_contract":"accepted_planning_state.v1","validated_schema_version":1,"validation_mode":"artifact_file","warning_count":0,"warnings":[]}},{"path":"study_results/accepted_planning_state_opm.json","report":{"artifact_path":"study_results/accepted_planning_state_opm.json","assumptions":{"json_schema_export_scope":"top_level_compatibility","validation_scope":"executable_contract_required_fields_and_semantic_checks","validator":"OrbitalDynamics.Schema.validate_artifact"},"error_count":0,"errors":[],"model":"executable_artifact_contract_validation","model_limits":["top_level_json_schema_compatibility_export","executable_elixir_validator_is_source_of_truth","semantic_checks_are_not_fully_represented_in_json_schema"],"remediation":[],"remediation_count":0,"schema_contract":"schema_validation_report.v1","status":"pass","validated_artifact_family":"accepted_planning_state","validated_contract":"accepted_planning_state.v1","validated_schema_version":1,"validation_mode":"artifact_file","warning_count":0,"warnings":[]}},{"path":"study_results/accepted_planning_state_simple.json","report":{"artifact_path":"study_results/accepted_planning_state_simple.json","assumptions":{"json_schema_export_scope":"top_level_compatibility","validation_scope":"executable_contract_required_fields_and_semantic_checks","validator":"OrbitalDynamics.Schema.validate_artifact"},"error_count":0,"errors":[],"model":"executable_artifact_contract_validation","model_limits":["top_level_json_schema_compatibility_export","executable_elixir_validator_is_source_of_truth","semantic_checks_are_not_fully_represented_in_json_schema"],"remediation":[],"remediation_count":0,"schema_contract":"schema_validation_report.v1","status":"pass","validated_artifact_family":"accepted_planning_state","validated_contract":"accepted_planning_state.v1","validated_schema_version":1,"validation_mode":"artifact_file","warning_count":0,"warnings":[]}},{"path":"study_results/activity_template_v1.json","report":{"artifact_path":"study_results/activity_template_v1.json","assumptions":{"json_schema_export_scope":"top_level_compatibility","validation_scope":"executable_contract_required_fields_and_semantic_checks","validator":"OrbitalDynamics.Schema.validate_artifact"},"error_count":0,"errors":[],"model":"executable_artifact_contract_validation","model_limits":["top_level_json_schema_compatibility_export","executable_elixir_validator_is_source_of_truth","semantic_checks_are_not_fully_represented_in_json_schema"],"remediation":[],"remediation_count":0,"schema_contract":"schema_validation_report.v1","status":"pass","validated_artifact_family":"activity_template","validated_contract":"activity_template.v1","validated_schema_version":1,"validation_mode":"artifact_file","warning_count":0,"warnings":[]}},{"path":"study_results/approval_requirement_v1.json","report":{"artifact_path":"study_results/approval_requirement_v1.json","assumptions":{"json_schema_export_scope":"top_level_compatibility","validation_scope":"executable_contract_required_fields_and_semantic_checks","validator":"OrbitalDynamics.Schema.validate_artifact"},"error_count":0,"errors":[],"model":"executable_artifact_contract_validation","model_limits":["top_level_json_schema_compatibility_export","executable_elixir_validator_is_source_of_truth","semantic_checks_are_not_fully_represented_in_json_schema"],"remediation":[],"remediation_count":0,"schema_contract":"schema_validation_report.v1","status":"pass","validated_artifact_family":"approval_requirement","validated_contract":"approval_requirement.v1","validated_schema_version":1,"validation_mode":"artifact_file","warning_count":0,"warnings":[]}},{"path":"study_results/backend_acceptance_policy_v1.json","report":{"artifact_path":"study_results/backend_acceptance_policy_v1.json","assumptions":{"json_schema_export_scope":"top_level_compatibility","validation_scope":"executable_contract_required_fields_and_semantic_checks","validator":"OrbitalDynamics.Schema.validate_artifact"},"error_count":0,"errors":[],"model":"executable_artifact_contract_validation","model_limits":["top_level_json_schema_compatibility_export","executable_elixir_validator_is_source_of_truth","semantic_checks_are_not_fully_represented_in_json_schema"],"remediation":[],"remediation_count":0,"schema_contract":"schema_validation_report.v1","status":"pass","validated_artifact_family":"backend_acceptance_policy","validated_contract":"backend_acceptance_policy.v1","validated_schema_version":1,"validation_mode":"artifact_file","warning_count":0,"warnings":[]}},{"path":"study_results/branch_comparison_report_v1.json","report":{"artifact_path":"study_results/branch_comparison_report_v1.json","assumptions":{"json_schema_export_scope":"top_level_compatibility","validation_scope":"executable_contract_required_fields_and_semantic_checks","validator":"OrbitalDynamics.Schema.validate_artifact"},"error_count":0,"errors":[],"model":"executable_artifact_contract_validation","model_limits":["top_level_json_schema_compatibility_export","executable_elixir_validator_is_source_of_truth","semantic_checks_are_not_fully_represented_in_json_schema"],"remediation":[],"remediation_count":0,"schema_contract":"schema_validation_report.v1","status":"pass","validated_artifact_family":"branch_comparison_report","validated_contract":"branch_comparison_report.v1","validated_schema_version":1,"validation_mode":"artifact_file","warning_count":0,"warnings":[]}},{"path":"study_results/cadence_import_manifest_v1.json","report":{"artifact_path":"study_results/cadence_import_manifest_v1.json","assumptions":{"json_schema_export_scope":"top_level_compatibility","validation_scope":"executable_contract_required_fields_and_semantic_checks","validator":"OrbitalDynamics.Schema.validate_artifact"},"error_count":0,"errors":[],"model":"executable_artifact_contract_validation","model_limits":["top_level_json_schema_compatibility_export","executable_elixir_validator_is_source_of_truth","semantic_checks_are_not_fully_represented_in_json_schema"],"remediation":[],"remediation_count":0,"schema_contract":"schema_validation_report.v1","status":"pass","validated_artifact_family":"cadence_import_manifest","validated_contract":"cadence_import_manifest.v1","validated_schema_version":1,"validation_mode":"artifact_file","warning_count":0,"warnings":[]}},{"path":"study_results/cadence_import_resource_pressure_v1.json","report":{"artifact_path":"study_results/cadence_import_resource_pressure_v1.json","assumptions":{"json_schema_export_scope":"top_level_compatibility","validation_scope":"executable_contract_required_fields_and_semantic_checks","validator":"OrbitalDynamics.Schema.validate_artifact"},"error_count":0,"errors":[],"model":"executable_artifact_contract_validation","model_limits":["top_level_json_schema_compatibility_export","executable_elixir_validator_is_source_of_truth","semantic_checks_are_not_fully_represented_in_json_schema"],"remediation":[],"remediation_count":0,"schema_contract":"schema_validation_report.v1","status":"pass","validated_artifact_family":"cadence_import_manifest","validated_contract":"cadence_import_manifest.v1","validated_schema_version":1,"validation_mode":"artifact_file","warning_count":0,"warnings":[]}},{"path":"study_results/cadence_import_resource_projection_battery_handoff_v1.json","report":{"artifact_path":"study_results/cadence_import_resource_projection_battery_handoff_v1.json","assumptions":{"json_schema_export_scope":"top_level_compatibility","validation_scope":"executable_contract_required_fields_and_semantic_checks","validator":"OrbitalDynamics.Schema.validate_artifact"},"error_count":0,"errors":[],"model":"executable_artifact_contract_validation","model_limits":["top_level_json_schema_compatibility_export","executable_elixir_validator_is_source_of_truth","semantic_checks_are_not_fully_represented_in_json_schema"],"remediation":[],"remediation_count":0,"schema_contract":"schema_validation_report.v1","status":"pass","validated_artifact_family":"cadence_import_manifest","validated_contract":"cadence_import_manifest.v1","validated_schema_version":1,"validation_mode":"artifact_file","warning_count":0,"warnings":[]}},{"path":"study_results/campaign_request_lint_v1.json","report":{"artifact_path":"study_results/campaign_request_lint_v1.json","assumptions":{"json_schema_export_scope":"top_level_compatibility","validation_scope":"executable_contract_required_fields_and_semantic_checks","validator":"OrbitalDynamics.Schema.validate_artifact"},"error_count":0,"errors":[],"model":"executable_artifact_contract_validation","model_limits":["top_level_json_schema_compatibility_export","executable_elixir_validator_is_source_of_truth","semantic_checks_are_not_fully_represented_in_json_schema"],"remediation":[],"remediation_count":0,"schema_contract":"schema_validation_report.v1","status":"pass","validated_artifact_family":"campaign_request_lint","validated_contract":"campaign_request